{
  "$schema": "../schema/template.schema.json",
  "id": "management-cockpit",
  "name": "AI 管理驾驶舱",
  "shortName": "管理驾驶舱",
  "category": "governance",
  "industries": [
    "finance",
    "retail",
    "manufacturing"
  ],
  "tagline": "一句话调用多业务系统，自动生成管理摘要",
  "icon": "chart",
  "highlight": true,
  "kpis": [
    {
      "label": "营收同比",
      "value": "+20%",
      "trend": "up"
    },
    {
      "label": "异常预警",
      "value": "3 项",
      "trend": "up"
    },
    {
      "label": "人工耗时",
      "value": "-70%",
      "trend": "down"
    },
    {
      "label": "报表产出",
      "value": "分钟级",
      "trend": "up"
    }
  ],
  "painPoints": [
    "销售、运营、财务数据分散在多个系统，管理者每天看十几张报表",
    "异常隐藏在海量指标里，靠人工逐张比对，发现慢、易漏",
    "管理摘要靠人工汇总，产出滞后、口径不一",
    "决策缺少「一页纸」的全局视图与可执行建议"
  ],
  "capabilities": [
    {
      "key": "编排",
      "name": "多智能体编排",
      "desc": "一次对话自动规划并依次调用多个业务系统"
    },
    {
      "key": "工具",
      "name": "工具调用",
      "desc": "联动 CRM / 运营分析 / ERP 财务等系统接口取数"
    },
    {
      "key": "检测",
      "name": "异常检测",
      "desc": "时序基线 + 趋势分析，自动定位偏离与风险"
    },
    {
      "key": "洞察",
      "name": "洞察生成",
      "desc": "把多源数据浓缩成一页可决策的管理摘要"
    }
  ],
  "orchestration": {
    "nodes": [
      {
        "id": "n1",
        "type": "input",
        "label": "管理者提问",
        "desc": "用一句话描述要汇总的范围与分析诉求"
      },
      {
        "id": "n2",
        "type": "intent",
        "label": "任务规划",
        "desc": "拆解为：取数 → 异常检测 → 洞察 → 生成摘要"
      },
      {
        "id": "n3",
        "type": "tool",
        "label": "多系统取数",
        "desc": "并行调用销售 / 运营 / 财务系统接口"
      },
      {
        "id": "n4",
        "type": "llm",
        "label": "异常检测",
        "desc": "趋势分析 + 基线比对，命中偏离与风险点"
      },
      {
        "id": "n5",
        "type": "output",
        "label": "管理摘要",
        "desc": "生成含 KPI、图表、告警与建议的一页摘要"
      }
    ]
  },
  "metrics": [
    {
      "name": "接入系统",
      "value": "3+",
      "unit": "个"
    },
    {
      "name": "覆盖指标",
      "value": "200+",
      "unit": "项"
    },
    {
      "name": "摘要产出",
      "value": "<1",
      "unit": "分钟"
    },
    {
      "name": "异常召回",
      "value": "95",
      "unit": "%"
    }
  ],
  "demo": {
    "presets": [
      {
        "title": "一句话生成管理摘要",
        "user": "把销售、运营、财务系统的数据汇总成一份管理摘要，标出异常并给改善建议。",
        "steps": [
          {
            "type": "intent",
            "text": "任务规划：取数（销售/运营/财务）→ 异常检测 → 洞察 → 生成摘要"
          },
          {
            "type": "tool",
            "text": "调用销售系统（CRM）→ GET /crm/sales?range=today → 1,284 笔订单"
          },
          {
            "type": "tool",
            "text": "调用运营系统（Analytics）→ GET /ops/metrics → DAU 8.6w · 转化 3.2%"
          },
          {
            "type": "tool",
            "text": "调用财务系统（ERP）→ GET /finance/ledger → 回款 ¥2.13M"
          },
          {
            "type": "llm",
            "text": "异常检测 · 趋势分析：扫描各指标基线，命中 3 处偏离"
          },
          {
            "type": "chart",
            "chartType": "line",
            "text": "近 7 日营收趋势（万元）",
            "bars": [
              {
                "label": "周一",
                "pct": 32,
                "value": "32"
              },
              {
                "label": "周二",
                "pct": 46,
                "value": "46"
              },
              {
                "label": "周三",
                "pct": 40,
                "value": "40"
              },
              {
                "label": "周四",
                "pct": 58,
                "value": "58"
              },
              {
                "label": "周五",
                "pct": 52,
                "value": "52"
              },
              {
                "label": "周六",
                "pct": 74,
                "value": "74"
              },
              {
                "label": "周日",
                "pct": 90,
                "value": "90"
              }
            ]
          },
          {
            "type": "answer",
            "text": "## 今日管理摘要\n核心经营面健康，营收同比 **+20%**，本日汇总已自动完成（人工耗时 -70%）。\n## 关键指标\n- **营收**：同比 +20%，已达季度目标 **70%**。\n- **订单**：1,284 笔，环比平稳。\n- **回款**：¥2.13M，整体达预期。\n## 异常预警（3 项）\n- ⚠ 某 SKU **库存超标 15%**，建议下调下周备货。\n- ⚠ **华东区回款滞后 8%**，建议跟进重点客户。\n- ✓ 营收同比 +20%，已达季度目标 70%，进度健康。\n## 结论\n整体经营稳中向好，风险集中在库存与回款两处，均已给出明确处置建议。\n> 摘要已推送至管理层，是否就「回款滞后」展开异常下钻？"
          }
        ]
      },
      {
        "title": "异常下钻归因",
        "user": "华东区回款为什么滞后？帮我拆一下原因。",
        "steps": [
          {
            "type": "intent",
            "text": "意图识别：回款滞后归因（华东区，环比）"
          },
          {
            "type": "tool",
            "text": "调用财务系统 → 下钻华东区账期/客户/行业三维度"
          },
          {
            "type": "chart",
            "chartType": "hbar",
            "text": "华东区回款滞后归因（万元）",
            "bars": [
              {
                "label": "大客户账期延长",
                "pct": 100,
                "value": "-128"
              },
              {
                "label": "新签合同回款慢",
                "pct": 55,
                "value": "-71"
              },
              {
                "label": "存量正常回款",
                "pct": 30,
                "value": "+39"
              }
            ]
          },
          {
            "type": "answer",
            "text": "## 归因结论\n华东区回款滞后的缺口主要来自账期，而非真实坏账：\n- **大客户账期延长**：-128 万，**第一主因**，集中在 **3 家制造业重点客户**。\n- **新签合同回款慢**：-71 万，回款节点条款偏松。\n- **存量正常回款**：+39 万，基本盘稳定。\n## 行动建议\n- 由**大客户经理本周内逐一跟进**这 3 家客户账期。\n- 对新签合同**补充回款节点条款**，从源头收紧账期。\n> 是否生成「重点客户账期跟进清单」并指派到人？"
          }
        ]
      },
      {
        "title": "一键生成经营日报",
        "user": "把今天的分析整理成一份经营日报，推送给管理层。",
        "steps": [
          {
            "type": "intent",
            "text": "意图识别：报告生成（经营日报）"
          },
          {
            "type": "rag",
            "text": "套用「每日经营日报」模板，回填 KPI、图表与异常结论"
          },
          {
            "type": "doc",
            "text": "已生成经营日报，可在线编辑后一键推送",
            "doc": {
              "title": "今日经营日报",
              "meta": "自动生成 · 数据截至 09:00 · 可在线编辑",
              "body": [
                "一、核心 KPI：营收同比 +20%，已达季度目标 70%。",
                "二、风险提示：某 SKU 库存超标 15%；华东区回款滞后 8%。",
                "三、归因结论：回款滞后主因大客户账期延长（-128 万）。",
                "四、行动建议：下调下周备货、跟进重点客户账期。"
              ]
            }
          },
          {
            "type": "answer",
            "text": "## 经营日报已生成\n《今日经营日报》已自动成稿并推送至管理层企业微信，包含 **趋势图 + 归因图 + 行动建议**。\n- 内容覆盖核心 KPI、风险提示、归因结论与行动建议四部分。\n- 支持在线编辑与下钻原始数据。\n> 是否同步**抄送财务与运营负责人**？"
          }
        ]
      }
    ]
  },
  "build": {
    "intro": "驾驶舱的关键是「多系统打通 + 异常规则 + 摘要模板」，先接数据源，再配检测与模板。",
    "steps": [
      {
        "title": "打通多业务系统",
        "desc": "登记销售、运营、财务等系统接口，定义取数口径与鉴权，用沙箱账号联调确认能取到真实指标。"
      },
      {
        "title": "配置异常检测规则",
        "desc": "为关键指标设置时序基线与环比阈值，配置趋势分析与偏离检测，沉淀高频风险规则。"
      },
      {
        "title": "编排驾驶舱 Agent",
        "desc": "用多智能体编排串联任务规划 → 并行取数 → 异常检测 → 洞察生成，关键结论前插入人工确认卡点。"
      },
      {
        "title": "挂接摘要模板",
        "desc": "登记「经营日报 / 管理摘要」模板，绑定 KPI 位、图表位与告警位，历史数据回放校验后再灰度。"
      }
    ]
  },
  "deploy": {
    "intro": "面向管理层的决策型应用，按「试运行 → 口径校准 → 全面推送 → 持续运营」上线。",
    "steps": [
      {
        "title": "小范围试运行",
        "desc": "先对核心管理者推送每日摘要，验证取数准确率与异常召回，收集真实关注点。"
      },
      {
        "title": "口径与规则校准",
        "desc": "对误报/漏报异常反馈纠正，校准基线阈值与归因维度，统一各系统指标口径。"
      },
      {
        "title": "全面推送上线",
        "desc": "嵌入移动办公入口，按角色分层推送管理摘要与经营日报，支持在线编辑与下钻。"
      },
      {
        "title": "持续运营迭代",
        "desc": "监控摘要采纳率与异常命中率，按需扩展接入系统与报告模板，规则按周迭代。"
      }
    ]
  }
}
