{
  "$schema": "../schema/template.schema.json",
  "id": "edu-assistant",
  "audience": "customer",
  "name": "AI 智能助教",
  "shortName": "智能助教",
  "category": "service",
  "industries": [
    "education"
  ],
  "tagline": "学科解题 + 学情分析 + 校园答疑",
  "icon": "edu",
  "highlight": true,
  "kpis": [
    {
      "label": "学生自助答疑率",
      "value": "+62%",
      "trend": "up"
    },
    {
      "label": "教师备课效率",
      "value": "+45%",
      "trend": "up"
    },
    {
      "label": "辅导员答疑工时",
      "value": "-3250h",
      "trend": "down"
    }
  ],
  "painPoints": [
    "学生课后答疑高峰集中，教师/辅导员难以一一即时响应",
    "解题只给答案不给思路，学生知其然不知其所以然",
    "学情数据散落在各科系统，老师难以快速发现薄弱知识点",
    "校园事务咨询（选课、奖助、宿舍）重复问题多，占用大量人力"
  ],
  "capabilities": [
    {
      "key": "解题",
      "name": "学科解题辅导",
      "desc": "分步讲解思路而非直接给答案，覆盖多学科"
    },
    {
      "key": "学情",
      "name": "学情数据分析",
      "desc": "自然语言查成绩/作业，定位薄弱知识点"
    },
    {
      "key": "知识",
      "name": "校园知识问答",
      "desc": "选课、奖助、宿舍等事务可信问答"
    },
    {
      "key": "多模态",
      "name": "拍照解题",
      "desc": "上传题目照片识别题干并讲解"
    }
  ],
  "metrics": [
    {
      "name": "覆盖学校",
      "value": "140+",
      "unit": "所"
    },
    {
      "name": "累计服务",
      "value": "3.7w",
      "unit": "人次"
    },
    {
      "name": "自动答疑率",
      "value": "96",
      "unit": "%"
    },
    {
      "name": "知识库条目",
      "value": "5亿",
      "unit": "字"
    }
  ],
  "demo": {
    "presets": [
      {
        "title": "拍照解题分步讲解（多模态）",
        "user": "[题目照片] 这道二次函数的题我不会，帮我讲讲思路。",
        "steps": [
          {
            "type": "intent",
            "text": "意图识别：学科解题辅导（数学·二次函数）"
          },
          {
            "type": "multimodal",
            "text": "调用 OCR 公式识别工具 → 识别题干：求 f(x)=x²-4x+3 的最小值及对称轴（置信度 97%）"
          },
          {
            "type": "rag",
            "text": "知识库召回《二次函数图像与性质》知识点 + 同类例题 3 道"
          },
          {
            "type": "answer",
            "text": "## 解题思路（先想方法，别急着算）\n这是求二次函数最值的题，关键是**配方法**或**顶点公式**。\n## 分步讲解\n1. 函数 f(x)=x²-4x+3，二次项系数 a=1>0，开口向上，所以有**最小值**。\n2. 对称轴公式 x = -b/(2a) = -(-4)/(2×1) = **2**。\n3. 把 x=2 代入：f(2)=4-8+3 = **-1**，即最小值为 -1。\n## 结论\n- 对称轴：x = 2\n- 最小值：-1（在顶点处取得）\n## 举一反三\n试试自己求 f(x)=x²+6x+5 的最小值？方法完全一样。\n> 需要我再出 2 道同类练习题巩固吗？"
          }
        ]
      },
      {
        "title": "学情分析定位薄弱点",
        "user": "帮我看看初二(3)班这次月考数学，哪个知识点掌握得最差？",
        "steps": [
          {
            "type": "intent",
            "text": "意图识别：学情数据分析（班级·知识点掌握度）"
          },
          {
            "type": "tool",
            "text": "调用成绩管理系统接口 → 取初二(3)班月考数学逐题得分率"
          },
          {
            "type": "tool",
            "text": "调用知识点标注工具 → 将题目映射到对应知识点并聚合得分率"
          },
          {
            "type": "chart",
            "chartType": "bar",
            "text": "初二(3)班各知识点平均得分率",
            "bars": [
              {
                "label": "有理数运算",
                "pct": 92,
                "value": "92%"
              },
              {
                "label": "一次函数",
                "pct": 78,
                "value": "78%"
              },
              {
                "label": "全等三角形",
                "pct": 61,
                "value": "61% ⚠"
              },
              {
                "label": "不等式组",
                "pct": 54,
                "value": "54% ⚠"
              }
            ]
          },
          {
            "type": "answer",
            "text": "## 学情结论\n本次月考全班整体均分 81，但有两个知识点明显偏弱：\n- ⚠ **不等式组**：得分率仅 54%，是最薄弱环节，错误集中在「解集取交集」。\n- ⚠ **全等三角形**：61%，证明题步骤不规范丢分较多。\n- 有理数运算、一次函数掌握良好。\n## 教学建议\n- 下周优先**重讲不等式组解集**，配套 2 节专题练习。\n- 全等三角形以**证明书写规范**为重点讲评。\n> 是否一键生成针对这两个知识点的错题集与讲评课件？"
          }
        ]
      },
      {
        "title": "校园事务智能答疑",
        "user": "我是大二学生，想申请国家助学金，需要哪些材料、什么时候截止？",
        "steps": [
          {
            "type": "intent",
            "text": "意图识别：校园事务问答（奖助学金·申请材料）"
          },
          {
            "type": "rag",
            "text": "调用校园知识库 → 召回《国家助学金评定办法》与本年度通知 2 处依据"
          },
          {
            "type": "answer",
            "text": "申请国家助学金需准备以下材料：\n  1. 《国家助学金申请表》（教务系统下载，需辅导员签字）；\n  2. 家庭经济困难认定材料（已通过认定的同学可免交）；\n  3. 本人身份证、学生证复印件；\n  4. 个人银行卡（用于发放，须为本人名下）。\n**申请流程**：个人申请 → 班级民主评议 → 学院初审 → 学校审核公示。\n**截止时间**：本学期助学金申请截止 **9 月 25 日 17:00**，逾期不再受理。\n（来源：本年度助学金评定通知，可点击查看原文）\n> 需要我帮你直接打开《申请表》下载入口吗？"
          }
        ]
      }
    ]
  }
}
