{
  "$schema": "../schema/template.schema.json",
  "id": "change-apply",
  "name": "智能变更申请",
  "shortName": "五级变更",
  "category": "ops",
  "industries": [
    "telecom",
    "government"
  ],
  "tagline": "自动填单、自动审查、自动合规校验",
  "icon": "shield",
  "kpis": [
    {
      "label": "填单耗时",
      "value": "-75%",
      "trend": "down"
    },
    {
      "label": "审查通过率",
      "value": "+22%",
      "trend": "up"
    },
    {
      "label": "高危变更拦截",
      "value": "+40%",
      "trend": "up"
    }
  ],
  "painPoints": [
    "五级变更字段繁多，填单耗时长且易错",
    "审查依赖专家经验，效率瓶颈",
    "合规要求频繁更新，人工核对易遗漏"
  ],
  "capabilities": [
    {
      "key": "填单",
      "name": "自动填单",
      "desc": "对话式信息收集 + 模板自动生成"
    },
    {
      "key": "审查",
      "name": "智能审查",
      "desc": "技术方案合理性 + 风险评估"
    },
    {
      "key": "合规",
      "name": "合规校验",
      "desc": "对照最新规范库自动校验"
    }
  ],
  "orchestration": {
    "nodes": [
      {
        "id": "n1",
        "type": "input",
        "label": "对话描述",
        "desc": "运维人员用自然语言描述变更操作意图"
      },
      {
        "id": "n2",
        "type": "intent",
        "label": "意图与取参",
        "desc": "识别变更类型，逐项追问补全关键参数"
      },
      {
        "id": "n3",
        "type": "llm",
        "label": "方案生成",
        "desc": "自动生成操作方案与五级变更工单"
      },
      {
        "id": "n4",
        "type": "rag",
        "label": "合规校验",
        "desc": "对照最新规范库 + 权限校验，拦截违规"
      },
      {
        "id": "n5",
        "type": "action",
        "label": "提交闭环",
        "desc": "重保期高危/非变更类自动退单提醒"
      }
    ]
  },
  "metrics": [
    {
      "name": "接入用户",
      "value": "300",
      "unit": "人"
    },
    {
      "name": "累计工单",
      "value": "3000+",
      "unit": "张"
    },
    {
      "name": "审批时长",
      "value": "10-20",
      "unit": "分钟"
    },
    {
      "name": "累计节省",
      "value": "250",
      "unit": "人日"
    }
  ],
  "demo": {
    "presets": [
      {
        "title": "对话式填单生成方案",
        "user": "我要给核心机房一台交换机做端口扩容，帮我起个变更单。",
        "steps": [
          {
            "type": "intent",
            "text": "意图识别：五级变更申请（设备配置变更）"
          },
          {
            "type": "tool",
            "text": "调用资产配置管理系统（CMDB）接口取设备信息 → 并对话追问补全：变更窗口、影响范围、回退方案"
          },
          {
            "type": "doc",
            "text": "已自动生成变更操作方案与工单草稿",
            "doc": {
              "title": "五级变更操作工单（草稿）",
              "meta": "自动生成 · 待合规校验",
              "body": [
                "变更类型：设备配置变更（端口扩容）",
                "目标网元：核心机房 SW-CORE-03，新增上联 10GE×2",
                "变更窗口：本周六 02:00-04:00（业务低谷）",
                "影响范围：无业务中断（热插拔 + 预配置）",
                "回退方案：保留原配置快照，异常 10 分钟内回退"
              ]
            }
          },
          {
            "type": "answer",
            "text": "工单草稿已生成，关键字段均已补全。下一步将自动做合规与权限校验，通过后即可提交审批。"
          }
        ]
      },
      {
        "title": "合规与权限校验拦截",
        "user": "这个变更单帮我提交审批吧。",
        "steps": [
          {
            "type": "intent",
            "text": "意图识别：变更提交（合规 + 权限校验）"
          },
          {
            "type": "rag",
            "text": "对照最新《五级变更管理规范》逐项校验，并核验操作人权限"
          },
          {
            "type": "verdict",
            "text": "合规校验结果",
            "verdict": {
              "result": "校验未通过 · 需补正",
              "tone": "warn",
              "summary": "方案主体合规，但缺少必备项，已拦截提交并给出补正建议。",
              "points": [
                "缺少「变更前后配置比对附件」——规范 3.4 条要求必传",
                "回退验证步骤未写明验证指标，建议补充 ping/业务拨测项",
                "操作人具备该网元操作权限 ✓，无越权风险"
              ]
            }
          },
          {
            "type": "answer",
            "text": "已拦截本次提交并标注 2 处需补正项。补齐配置比对附件与回退验证指标后，可一键重新校验提交，预计审批 10-20 分钟内完成。"
          }
        ]
      },
      {
        "title": "重保期高危自动退单",
        "user": "今天帮我安排一个核心网参数批量调整的变更。",
        "steps": [
          {
            "type": "intent",
            "text": "意图识别：变更申请（核心网批量参数调整）"
          },
          {
            "type": "rag",
            "text": "知识库校验：识别当前处于「春节重保期」，且操作属高危批量变更"
          },
          {
            "type": "verdict",
            "text": "重保期变更管控结论",
            "verdict": {
              "result": "建议退单 · 重保期管控",
              "tone": "fail",
              "summary": "当前为重保封网期，核心网批量参数调整属高危操作，按规范不予受理。",
              "points": [
                "命中规则：重保期内禁止非故障处置类高危变更",
                "如确为紧急故障处置，请改走「应急变更」通道并附故障工单号",
                "建议变更窗口：重保结束后（2 月 18 日起）按计划提交"
              ]
            }
          },
          {
            "type": "answer",
            "text": "本次变更已自动退单并说明原因。若为紧急故障处置，请提供故障工单号，我帮您转「应急变更」绿色通道。"
          }
        ]
      }
    ]
  },
  "build": {
    "intro": "变更场景核心是「会取参 + 强合规」，先建规范库，再配工单模板与校验规则。",
    "steps": [
      {
        "title": "建设变更规范库",
        "desc": "导入五级变更管理规范、各专业操作规范与重保期规则并向量化，作为合规校验依据，保留条文出处。"
      },
      {
        "title": "配置工单模板与取参",
        "desc": "定义各类变更工单字段模板，配置对话式追问逻辑，确保网元、窗口、影响、回退等关键项必填补全。"
      },
      {
        "title": "编排校验规则",
        "desc": "配置合规校验（必备附件、回退验证等）、权限校验与重保期/高危识别规则，命中即拦截或退单。"
      },
      {
        "title": "对接审批流",
        "desc": "校验通过后自动推送至现有审批系统，全流程留痕，联调确认端到端闭环。"
      }
    ]
  },
  "deploy": {
    "intro": "变更直接影响生产网络，采用「旁路建单 → 校验把关 → 闭环管控 → 规则迭代」的稳健上线。",
    "steps": [
      {
        "title": "旁路试运行",
        "desc": "先以「辅助建单」模式接入少量用户，人工复核生成方案与校验结论的准确性。"
      },
      {
        "title": "校验把关评测",
        "desc": "用历史变更工单回测合规校验命中率与误拦率，规则与各专业评审对齐。"
      },
      {
        "title": "闭环管控上线",
        "desc": "正式接入审批流，覆盖云、传输、视频等专业，实现端到端变更管控闭环。"
      },
      {
        "title": "规则持续迭代",
        "desc": "规范更新即同步知识库，监控审批时长、拦截率与退单准确率，按需优化规则。"
      }
    ]
  }
}
