{
  "$schema": "../schema/template.schema.json",
  "id": "chatbi",
  "name": "智能问数助手",
  "shortName": "智能问数",
  "category": "data",
  "industries": [
    "finance",
    "retail",
    "education",
    "manufacturing"
  ],
  "tagline": "一句话问数、自动归因、自动出报告",
  "icon": "chart",
  "kpis": [
    {
      "label": "取数响应时长",
      "value": "-90%",
      "trend": "down"
    },
    {
      "label": "报告产出效率",
      "value": "10x",
      "trend": "up"
    },
    {
      "label": "查询准确率",
      "value": "94%",
      "trend": "up"
    }
  ],
  "painPoints": [
    "业务方提需求 → 数据团队写 SQL → 等待 1-3 天，效率低",
    "归因分析依赖经验，结论难复用",
    "报告产出靠手工，难以日常化"
  ],
  "capabilities": [
    {
      "key": "查数",
      "name": "自然语言查数",
      "desc": "自然语言转查询语句，支持多表关联 + 复杂指标"
    },
    {
      "key": "归因",
      "name": "智能归因",
      "desc": "维度下钻 + 异常波动自动归因"
    },
    {
      "key": "报告",
      "name": "报告生成",
      "desc": "图表 + 文字结论一键生成报告"
    }
  ],
  "orchestration": {
    "nodes": [
      {
        "id": "n1",
        "type": "input",
        "label": "自然语言提问",
        "desc": "业务人员用一句话描述取数与分析诉求"
      },
      {
        "id": "n2",
        "type": "intent",
        "label": "语义解析",
        "desc": "识别指标、维度、时间范围与分析意图"
      },
      {
        "id": "n3",
        "type": "tool",
        "label": "Text2SQL",
        "desc": "动态生成查询 SQL，支持多表关联与四级穿透"
      },
      {
        "id": "n4",
        "type": "llm",
        "label": "归因分析",
        "desc": "维度下钻，对异常波动自动归因"
      },
      {
        "id": "n5",
        "type": "output",
        "label": "图文报告",
        "desc": "生成图表 + 文字结论，支持在线编辑与导出"
      }
    ]
  },
  "metrics": [
    {
      "name": "接入指标",
      "value": "3000+",
      "unit": "个"
    },
    {
      "name": "服务人员",
      "value": "1200",
      "unit": "人"
    },
    {
      "name": "累计调用",
      "value": "4.1w",
      "unit": "次"
    },
    {
      "name": "取数响应",
      "value": "秒",
      "unit": "级"
    }
  ],
  "demo": {
    "presets": [
      {
        "title": "一句话问数（出图）",
        "user": "帮我看看本月各渠道的新增用户，按渠道排个序。",
        "steps": [
          {
            "type": "intent",
            "text": "语义解析：指标=新增用户，维度=渠道，时间=本月，意图=排名"
          },
          {
            "type": "tool",
            "text": "调用 Text2SQL 工具 + 数仓查询引擎 → 生成并执行 SELECT channel, SUM(new_users) ... GROUP BY channel ORDER BY 2 DESC"
          },
          {
            "type": "chart",
            "chartType": "bar",
            "text": "本月各渠道新增用户（万户）",
            "bars": [
              {
                "label": "线上自营",
                "pct": 100,
                "value": "12.4"
              },
              {
                "label": "实体门店",
                "pct": 70,
                "value": "8.7"
              },
              {
                "label": "社区网格",
                "pct": 45,
                "value": "5.6"
              },
              {
                "label": "异业合作",
                "pct": 26,
                "value": "3.2"
              }
            ]
          },
          {
            "type": "answer",
            "text": "## 结论速览\n本月新增用户合计 **29.9 万户**，环比 **+12%**，超额完成月度目标（目标 27 万）。\n## 渠道表现\n- **线上自营**：12.4 万户，占比 **41%**，稳居第一，获客成本同步下降 8%。\n- **实体门店**：8.7 万户，占比 29%，主力盘稳定。\n- **社区网格**：5.6 万户，环比 **+23%**，增长最快，单客价值高于均值。\n- **异业合作**：3.2 万户，占比偏低，转化链路较长。\n## 行动建议\n- 向**社区网格**追加资源，复制高转化网格的打法，预计可再带来约 1.5 万增量。\n- 优化**异业合作**的落地承接页与核销流程，缩短转化链路。\n> 需要我把以上结论一键生成「渠道经营周报」并推送到群里吗？"
          }
        ]
      },
      {
        "title": "收入下滑自动归因",
        "user": "为什么这个月宽带收入比上月少了？帮我拆一下原因。",
        "steps": [
          {
            "type": "intent",
            "text": "意图识别：收入波动归因（宽带，环比）"
          },
          {
            "type": "tool",
            "text": "调用 Text2SQL 工具 + 数仓查询引擎 → 取数：宽带收入环比 -4.8%，下钻 新增/存量/流失 三维度"
          },
          {
            "type": "chart",
            "chartType": "hbar",
            "text": "宽带收入环比变动归因（万元）",
            "bars": [
              {
                "label": "存量 ARPU 下降",
                "pct": 100,
                "value": "-186"
              },
              {
                "label": "流失增加",
                "pct": 62,
                "value": "-115"
              },
              {
                "label": "新增带来增量",
                "pct": 40,
                "value": "+74"
              }
            ]
          },
          {
            "type": "answer",
            "text": "## 归因结论\n本月宽带收入环比 **-4.8%**，缺口主要由三部分构成：\n- **存量 ARPU 下降**：-186 万，贡献最大，是第一主因。\n- **用户流失增加**：-115 万，为第二主因。\n- **新增带来增量**：+74 万，仅部分对冲缺口。\n## 下钻发现\n- ARPU 下降集中在 **2 年以上老用户**的 100M 套餐，降档与停增值业务明显。\n- 流失高发于近 3 个月有过投诉记录的用户群。\n## 行动建议\n- 对老用户**定向推送提速包与融合升级**，优先触达降档人群。\n- 对高流失风险用户启动挽留关怀，配套权益召回。\n> 预计两项措施可对冲约 **130 万** 缺口，是否生成执行清单？"
          }
        ]
      },
      {
        "title": "一键生成专题通报",
        "user": "把上面的分析整理成一份本月宽带经营通报，发给领导。",
        "steps": [
          {
            "type": "intent",
            "text": "意图识别：报告生成（专题通报）"
          },
          {
            "type": "rag",
            "text": "套用「月度经营通报」模板，回填指标、图表与归因结论"
          },
          {
            "type": "doc",
            "text": "已生成图文通报，可在线编辑后导出长图 / Word",
            "doc": {
              "title": "本月宽带经营专题通报",
              "meta": "自动生成 · 数据截至昨日 · 可在线编辑",
              "body": [
                "一、整体概况：宽带收入环比 -4.8%，用户净增 2.1 万户。",
                "二、核心归因：存量 ARPU 下降为主因（-186 万），老用户 100M 套餐降档明显。",
                "三、风险提示：2 年以上老用户流失率升至 1.8%，高于警戒线。",
                "四、行动建议：定向推送提速包与融合升级，渠道侧加大社区网格投入。"
              ]
            }
          },
          {
            "type": "answer",
            "text": "## 通报已生成\n《本月宽带经营专题通报》已自动成稿，包含 **1 张趋势图 + 1 张归因图 + 4 段结论**，排版可直接对外。\n- 支持**在线编辑**，所改即所见。\n- 支持一键导出**长图 / Word**，或推送到企业微信。\n> 需要我直接推送到「经营分析」群，并 @ 相关负责人吗？"
          }
        ]
      }
    ]
  },
  "build": {
    "intro": "数据问答的关键是「指标口径」先标准化，再配 Text2SQL 与归因，最后挂报告模板。",
    "steps": [
      {
        "title": "接入数据源与指标口径",
        "desc": "连接数仓/数据库，登记省级 + 地市个性化指标及其口径、维度与权限，统一命名，避免「同名不同义」。"
      },
      {
        "title": "训练 Text2SQL 能力",
        "desc": "用业务问法样本微调/校准自然语言转 SQL，配置多表关联与四级穿透规则，沉淀高频问法到知识库提升命中。"
      },
      {
        "title": "编排问数 Agent 与归因",
        "desc": "串联语义解析 → 取数 → 归因下钻 → 图表渲染；配置归因维度树（新增/存量/流失等）与异常阈值。"
      },
      {
        "title": "挂接报告模板与校验",
        "desc": "登记「月度通报」等模板，绑定指标位与图表位；用历史问句回归校验取数准确率达 90%+ 再灰度。"
      }
    ]
  },
  "deploy": {
    "intro": "面向经分人员的工具型应用，按「小范围试用 → 准确率达标 → 全省放量 → 持续补口径」上线。",
    "steps": [
      {
        "title": "小范围试用",
        "desc": "先开放给省市经分核心用户，重点验证取数准确率与归因合理性，收集真实问法。"
      },
      {
        "title": "准确率评测回归",
        "desc": "建立问句-答案评测集，每次模型/口径更新都回归，错误问法回流补充语料。"
      },
      {
        "title": "全省放量上线",
        "desc": "嵌入经营分析系统与移动办公入口，开放给各级领导、市场、渠道与一线人员。"
      },
      {
        "title": "口径与模板迭代",
        "desc": "按月新增指标与通报模板，监控调用量与采纳率，对低命中问法持续优化。"
      }
    ]
  }
}
