{
  "$schema": "../schema/template.schema.json",
  "id": "med-triage",
  "audience": "customer",
  "name": "智能导诊助手",
  "shortName": "智能导诊",
  "category": "service",
  "industries": [
    "healthcare"
  ],
  "tagline": "症状理解 + 智能分诊 + 就医指引",
  "icon": "headset",
  "highlight": true,
  "kpis": [
    {
      "label": "首次分诊准确率",
      "value": "91%",
      "trend": "up"
    },
    {
      "label": "导诊台排队下降",
      "value": "-55%",
      "trend": "down"
    },
    {
      "label": "患者就医满意度",
      "value": "+18点",
      "trend": "up"
    }
  ],
  "painPoints": [
    "患者不清楚该挂哪个科，挂错号、反复跑、就医体验差",
    "导诊台高峰排长队，人工导诊靠经验、口径不一",
    "院内科室分布、检查须知、医保政策咨询量大且重复",
    "症状描述口语化，需准确理解并匹配到正确科室与医生"
  ],
  "capabilities": [
    {
      "key": "症状",
      "name": "症状语义理解",
      "desc": "口语化症状描述转标准医学术语"
    },
    {
      "key": "分诊",
      "name": "智能分诊匹配",
      "desc": "按症状 + 年龄 + 病史匹配科室与号源"
    },
    {
      "key": "知识",
      "name": "就医知识问答",
      "desc": "科室分布、检查须知、医保政策可信问答"
    },
    {
      "key": "号源",
      "name": "号源实时查询",
      "desc": "联动 HIS 查询科室当日可约号源"
    }
  ],
  "metrics": [
    {
      "name": "覆盖科室",
      "value": "40+",
      "unit": "个"
    },
    {
      "name": "日均导诊",
      "value": "6000",
      "unit": "人次"
    },
    {
      "name": "分诊准确率",
      "value": "91",
      "unit": "%"
    },
    {
      "name": "知识库条目",
      "value": "8000+",
      "unit": "条"
    }
  ],
  "demo": {
    "presets": [
      {
        "title": "症状理解智能分诊",
        "user": "我这两天胸口闷、有点喘不上气，还心慌，应该挂什么科？",
        "steps": [
          {
            "type": "intent",
            "text": "意图识别：症状分诊（胸闷 / 气促 / 心慌）"
          },
          {
            "type": "llm",
            "text": "症状语义解析 → 标准化为：胸闷、呼吸困难、心悸，提示心血管 / 呼吸系统相关"
          },
          {
            "type": "rag",
            "text": "调用分诊知识库 → 召回《症状-科室分诊规则》匹配候选科室"
          },
          {
            "type": "tool",
            "text": "调用 HIS 号源接口 → 查询心血管内科、呼吸内科当日可约号源"
          },
          {
            "type": "answer",
            "text": "## 分诊建议\n根据您「胸闷、气促、心慌」的症状，建议优先就诊：\n- **首选 · 心血管内科**：胸闷心慌可能与心脏相关，建议先排查。今日**有号（剩 6 个）**。\n- **备选 · 呼吸内科**：若伴随咳嗽、发热，可考虑呼吸系统问题。\n## 温馨提示\n- 如出现**剧烈胸痛、大汗、晕厥**等情况，请**立即前往急诊**，不要等候挂号。\n- 本建议仅供参考，最终诊断以医生面诊为准。\n> 是否帮您预约今日心血管内科的号？"
          }
        ]
      },
      {
        "title": "就医须知知识问答",
        "user": "明天要做胃镜，需要空腹吗？有什么要注意的？",
        "steps": [
          {
            "type": "intent",
            "text": "意图识别：检查须知问答（胃镜检查准备）"
          },
          {
            "type": "rag",
            "text": "调用院内知识库 → 召回《胃镜检查注意事项》患者须知 2 处依据"
          },
          {
            "type": "answer",
            "text": "## 胃镜检查须知\n**是的，需要空腹。** 请按以下准备：\n  1. 检查前**禁食 6-8 小时**，前一晚 22:00 后不再进食；\n  2. 检查当天**禁水**（或遵医嘱少量饮水送服药物）；\n  3. 取下活动假牙，穿宽松衣物；\n  4. 如有高血压，降压药可用少量水送服，**糖尿病药/胰岛素当日暂停**（遵医嘱）；\n  5. 做无痛胃镜需有**家属陪同**，检查后当天勿驾车。\n（来源：院内胃镜检查须知，可点击查看原文）\n> 需要我帮您查一下胃镜检查的具体地点和报到时间吗？"
          }
        ]
      },
      {
        "title": "院内导航与医保咨询",
        "user": "我用医保卡看病，门诊费用能报销吗？放射科在哪栋楼？",
        "steps": [
          {
            "type": "intent",
            "text": "意图识别：复合问答（医保报销 + 院内导航）"
          },
          {
            "type": "rag",
            "text": "调用医保政策知识库 → 召回门诊统筹报销规则"
          },
          {
            "type": "tool",
            "text": "调用院内导航服务 → 查询放射科位置与到达路线"
          },
          {
            "type": "answer",
            "text": "## 医保报销\n门诊费用**可以报销**（参保正常状态下）：\n- 普通门诊纳入**门诊统筹**，起付线以上按比例报销，三级医院在职职工约报 50%；\n- 检查、药品需在医保目录内方可报销；\n- 记得就诊全程使用**本人医保卡/电子凭证**结算。\n## 院内导航\n- **放射科**位于 **门诊楼 2 号楼 1 层东侧**（CT/DR/MRI 集中区）。\n- 路线：从门诊大厅进入 → 右转直行至 2 号楼 → 1 层即到，全程约 3 分钟。\n> 需要我把放射科的导航路线图发到您手机吗？"
          }
        ]
      }
    ]
  }
}
