{
  "$schema": "../schema/template.schema.json",
  "id": "wealth-advisor",
  "name": "理财顾问 Copilot",
  "shortName": "智能投顾",
  "category": "service",
  "industries": [
    "finance"
  ],
  "tagline": "客户画像 + 产品匹配 + 合规话术一体化",
  "icon": "headset",
  "highlight": true,
  "kpis": [
    {
      "label": "理财经理服务效率",
      "value": "+46%",
      "trend": "up"
    },
    {
      "label": "产品匹配采纳率",
      "value": "+31%",
      "trend": "up"
    },
    {
      "label": "合规话术差错",
      "value": "-90%",
      "trend": "down"
    }
  ],
  "painPoints": [
    "理财经理面对上千只基金/理财产品，匹配靠经验，难以兼顾客户风险承受能力",
    "投资问答涉及大量产品条款与净值数据，人工查询慢、口径不一",
    "营销话术稍有不慎即触碰适当性合规红线，事后质检成本高",
    "客户画像散落在 CRM、持仓、风测多个系统，难以一屏看全"
  ],
  "capabilities": [
    {
      "key": "画像",
      "name": "客户画像融合",
      "desc": "打通 CRM、持仓、风险测评，秒级生成 360° 画像"
    },
    {
      "key": "匹配",
      "name": "产品智能匹配",
      "desc": "按风险等级 + 偏好 + 净值表现匹配适当产品"
    },
    {
      "key": "知识",
      "name": "投资知识问答",
      "desc": "产品说明书、研报、净值数据可信问答与引用"
    },
    {
      "key": "合规",
      "name": "合规话术约束",
      "desc": "适当性管理护栏，话术实时合规校验"
    }
  ],
  "metrics": [
    {
      "name": "接入产品",
      "value": "1200+",
      "unit": "只"
    },
    {
      "name": "服务经理",
      "value": "3000",
      "unit": "人"
    },
    {
      "name": "日均问答",
      "value": "2.4w",
      "unit": "次"
    },
    {
      "name": "问答准确率",
      "value": "93",
      "unit": "%"
    }
  ],
  "demo": {
    "presets": [
      {
        "title": "客户画像 + 产品匹配",
        "user": "张女士今天来网点，想做点稳健的理财，帮我看看推荐什么？",
        "steps": [
          {
            "type": "intent",
            "text": "意图识别：客户产品匹配（稳健型理财推荐）"
          },
          {
            "type": "tool",
            "text": "调用 CRM 客户系统接口 → 取张女士基本信息：45 岁、企业中层、可投资产 80 万"
          },
          {
            "type": "tool",
            "text": "调用风险测评系统接口 → 风险等级 C3（稳健型），可承受中低波动"
          },
          {
            "type": "tool",
            "text": "调用持仓查询接口 → 当前持有：活期 30 万、3 个月定存 50 万，无权益类资产"
          },
          {
            "type": "rag",
            "text": "知识库召回《产品适当性匹配规则》+ C3 级在售产品池 18 只"
          },
          {
            "type": "answer",
            "text": "## 客户画像速览\n张女士为 **C3 稳健型**客户，资产以现金类为主，缺少中低波动的固收增强配置。\n## 推荐方案（均匹配 C3 适当性）\n- **稳健添益 90 天持有期**：近 1 年年化 3.2%，最大回撤 0.4%，适合作为定存替代。\n- **固收增强 FOF**：股债 2:8，目标年化 4%-5%，适合配置 20%-30%。\n- 建议保留 20 万活期作为流动性储备。\n## 合规提示\n- 以上为适当性匹配结果，须**当面完成风险揭示并双录**后方可办理。\n> 是否生成符合适当性要求的产品介绍话术？"
          }
        ]
      },
      {
        "title": "投资知识可信问答",
        "user": "客户问这只「固收增强 FOF」到底投什么，回撤大不大？我怎么解释？",
        "steps": [
          {
            "type": "intent",
            "text": "意图识别：产品知识问答（持仓结构 + 风险特征）"
          },
          {
            "type": "tool",
            "text": "调用净值数据接口 → 拉取该 FOF 近 3 年净值、最大回撤与同类排名"
          },
          {
            "type": "rag",
            "text": "知识库召回该产品《基金合同》《招募说明书》投资范围条款"
          },
          {
            "type": "answer",
            "text": "## 产品解读（可对客户讲）\n这是一只以**债券类资产为主（约 80%）**、辅以少量权益（约 20%）的 FOF：\n- **投资范围**：债券基金、货币基金为底仓，配置部分股票型/混合型基金增强收益。\n- **风险特征**：近 3 年最大回撤 **2.1%**，同类排名前 30%，波动明显低于纯权益产品。\n- **适合人群**：能接受小幅波动、追求略高于存款收益的稳健客户。\n## 客户沟通话术\n「这只产品八成投的是债券，比较稳，剩下两成投股票博取一点超额收益，过去三年最大也就回撤 2% 左右，比单买股票基金稳得多。」\n> 数据来源：基金合同 + 最新净值（截至昨日），可点击查看原文。"
          }
        ]
      },
      {
        "title": "营销话术合规质检",
        "user": "我准备这么跟客户说：「这款产品保本保息，年化 5% 稳赚不赔」，这样行吗？",
        "steps": [
          {
            "type": "intent",
            "text": "意图识别：营销话术合规预检（适当性管理）"
          },
          {
            "type": "rag",
            "text": "调用合规规则库 → 比对《资管新规》《理财销售管理办法》话术红线清单"
          },
          {
            "type": "verdict",
            "text": "话术合规稽核结论",
            "verdict": {
              "result": "存在违规表述 · 建议拦截",
              "tone": "fail",
              "summary": "话术包含「保本保息」「稳赚不赔」等违规承诺，触碰适当性红线，不得对客户使用。",
              "points": [
                "「保本保息」违反资管新规打破刚兑要求，理财产品不得承诺保本",
                "「稳赚不赔」属于误导性收益承诺，未做风险揭示",
                "「年化 5%」如为业绩比较基准，须标注且不得表述为预期收益",
                "建议改为：「业绩比较基准约 5%，不代表未来表现，产品有风险，投资需谨慎」"
              ]
            }
          },
          {
            "type": "answer",
            "text": "已拦截 2 处违规承诺。合规话术建议：\n「这款产品**业绩比较基准约 5%**，但这不代表未来收益，理财产品**不保本、有波动风险**，需要根据您的风险承受能力来选择，购买前请完整阅读产品说明书。」\n> 已自动记录本次质检，话术修正后可一键复检。"
          }
        ]
      }
    ]
  }
}
