{
  "$schema": "../schema/template.schema.json",
  "id": "knowledge-rag",
  "name": "企业知识库 RAG 问答助手",
  "shortName": "知识库问答",
  "category": "service",
  "industries": [
    "education",
    "government",
    "finance",
    "healthcare"
  ],
  "tagline": "多文档召回 · 引用溯源 · 追问澄清 · 权限隔离",
  "icon": "book",
  "highlight": true,
  "kpis": [
    {
      "label": "答案可溯源率",
      "value": "100%",
      "trend": "up"
    },
    {
      "label": "人工答疑工作量",
      "value": "-60%",
      "trend": "down"
    },
    {
      "label": "首次答准率",
      "value": "+35%",
      "trend": "up"
    },
    {
      "label": "平均响应时长",
      "value": "<2秒",
      "trend": "down"
    }
  ],
  "painPoints": [
    "制度、规章、产品手册散落在 OA / 网盘 / Wiki，员工「找不到、读不懂、问不到人」",
    "传统关键词检索召回差、答案没有出处，业务不敢直接采信",
    "通用大模型缺乏企业私有知识，容易「一本正经地胡说」，无引用依据",
    "不同部门 / 角色可见的知识范围不同，缺乏权限隔离易越权泄露敏感信息"
  ],
  "capabilities": [
    {
      "key": "检索",
      "name": "多源知识接入",
      "desc": "文档 / 网盘 / Wiki / 数据库统一接入，自动切片、向量化与增量同步"
    },
    {
      "key": "召回",
      "name": "混合检索重排",
      "desc": "向量 + 关键词混合召回，重排序提升相关性，按权限过滤可见文档"
    },
    {
      "key": "溯源",
      "name": "引用回链",
      "desc": "每条结论标注来源文档与段落，一键跳转原文，杜绝无依据作答"
    },
    {
      "key": "澄清",
      "name": "追问澄清",
      "desc": "问题模糊时主动反问，缩小检索范围，提升首次答准率"
    },
    {
      "key": "权限",
      "name": "权限隔离",
      "desc": "按部门 / 角色设定知识可见域与行级权限，敏感内容检索阶段即过滤"
    }
  ],
  "orchestration": {
    "nodes": [
      {
        "id": "n1",
        "type": "input",
        "label": "用户提问",
        "desc": "员工 / 客户用自然语言提出问题"
      },
      {
        "id": "n2",
        "type": "intent",
        "label": "意图与澄清",
        "desc": "判断是否需要追问澄清，补全检索条件"
      },
      {
        "id": "n3",
        "type": "rag",
        "label": "混合检索",
        "desc": "向量 + 关键词召回并重排，按角色权限过滤可见文档"
      },
      {
        "id": "n4",
        "type": "llm",
        "label": "受限生成",
        "desc": "仅基于召回片段生成答案，超纲 / 无依据则拒答"
      },
      {
        "id": "n5",
        "type": "output",
        "label": "引用溯源",
        "desc": "输出答案 + 来源引用 + 追问建议"
      }
    ]
  },
  "metrics": [
    {
      "name": "接入文档",
      "value": "12w+",
      "unit": "篇"
    },
    {
      "name": "知识切片",
      "value": "86w",
      "unit": "块"
    },
    {
      "name": "日均问答",
      "value": "2.3w",
      "unit": "次"
    },
    {
      "name": "召回命中率",
      "value": "94",
      "unit": "%"
    }
  ],
  "demo": {
    "presets": [
      {
        "title": "制度问答 · 差旅报销标准",
        "user": "出差住宿费报销标准是多少？需要哪些发票？",
        "steps": [
          {
            "type": "intent",
            "text": "意图识别：制度问答（差旅报销 - 住宿费标准 + 票据要求）"
          },
          {
            "type": "rag",
            "text": "知识库召回：《差旅费管理办法 V4》第 3 章、《报销票据清单》共 2 处依据，按「财务 / 全员」可见域过滤"
          },
          {
            "type": "llm",
            "text": "受限生成：仅基于召回片段作答，逐条标注引用来源"
          },
          {
            "type": "answer",
            "text": "## 住宿费报销标准\n根据《差旅费管理办法 V4》第 3.2 条：\n- **一线城市**：≤ 600 元 / 晚\n- **二线城市**：≤ 450 元 / 晚\n- **其他城市**：≤ 350 元 / 晚\n超标部分需部门负责人审批，仍超出则不予报销。\n## 所需票据\n  1. 住宿发票（增值税普通发票，抬头为公司全称）；\n  2. 出差审批单（含行程与天数）；\n  3. 行程单或订单截图。\n（来源：《差旅费管理办法 V4》第 3 章 · 点击查看原文）\n> 需要我帮你生成一份本次出差的报销清单模板吗？"
          }
        ]
      },
      {
        "title": "追问澄清 · 年假怎么休",
        "user": "我想休年假，怎么弄？",
        "steps": [
          {
            "type": "intent",
            "text": "意图识别：制度问答（年假），问题较宽泛，触发追问澄清以缩小范围"
          },
          {
            "type": "rag",
            "text": "知识库召回：《考勤与假期管理制度》第 5 章 年假章节"
          },
          {
            "type": "llm",
            "text": "受限生成：先按最高频意图「申请流程」作答，并引导继续追问其余方向"
          },
          {
            "type": "answer",
            "text": "你的问题涉及多个方面，我先按最常见的「申请流程」回答，其它可以继续追问：\n## 年假申请流程\n  1. 打开 OA → 假勤 → 年假申请；\n  2. 选择起止日期（系统自动校验剩余天数）；\n  3. 直属上级审批，连休 3 天以上需部门负责人审批；\n  4. 审批通过后自动同步考勤。\n## 相关规则\n- 剩余天数可在「我的假期」中查看；\n- 当年未休年假可结转至次年 Q1，逾期清零。\n（来源：《考勤与假期管理制度》第 5 章）\n> 想了解「剩余天数查询」或「年假折算规则」吗？点一下我继续。"
          }
        ]
      },
      {
        "title": "权限隔离 · 越权拒答",
        "user": "帮我查一下张总监的薪资，还有下季度的并购计划。",
        "steps": [
          {
            "type": "intent",
            "text": "意图识别：检测到涉及个人薪酬与未公开战略信息"
          },
          {
            "type": "tool",
            "text": "权限校验：调用权限服务 → 当前用户角色【普通员工】，无 HR 薪酬域 / 战略保密域访问权限"
          },
          {
            "type": "answer",
            "text": "抱歉，你当前的权限无法访问这些内容：\n- **个人薪酬信息**属于 HR 保密域，仅本人及授权 HR 可见；\n- **并购计划**属于战略保密文档，未对普通员工开放。\n如确有业务需要，请通过 OA 提交「知识访问授权」申请，由文档 Owner 审批。\n我可以帮你解答公开的制度、流程与产品类问题。\n> 需要我帮你发起一条访问授权申请吗？"
          }
        ]
      }
    ]
  },
  "build": {
    "intro": "从模板起步：先把企业知识接入并建立权限模型，再编排「检索 - 生成 - 溯源」链路，最后用真实问题集做评测，1~2 周即可上线。",
    "steps": [
      {
        "title": "接入与切片",
        "desc": "上传制度 / 手册 / Wiki / 网盘文档，平台自动切片、向量化并建立引用回链；配置增量同步，保持知识库新鲜。"
      },
      {
        "title": "配置权限模型",
        "desc": "按部门 / 角色定义知识可见域与行级权限，敏感文档单独打标，确保在检索阶段即过滤越权内容。"
      },
      {
        "title": "编排问答 Agent",
        "desc": "选择「标准模式」，串联意图澄清 → 混合检索（向量 + 关键词重排）→ 受限生成 → 引用溯源；开启「无依据则拒答」护栏。"
      },
      {
        "title": "评测与上线",
        "desc": "导入 200+ 真实高频问题做回归，校验答准率与引用正确率，达标后灰度，再全量发布到企业微信 / OA 入口。"
      }
    ]
  },
  "deploy": {
    "intro": "按「灰度 → 评测回归 → 生产放量 → 持续运营」推进，全程引用可查、操作留痕。",
    "steps": [
      {
        "title": "灰度发布",
        "desc": "先面向 1~2 个部门灰度，开启日志全量留存与人工抽检，观察答准率与拒答合理性。"
      },
      {
        "title": "效果评测与回归",
        "desc": "每日跑评测集 + 人工抽检，重点核对「答案 - 引用」一致性；坏样本回流知识库与提示词迭代。"
      },
      {
        "title": "生产环境上线",
        "desc": "通过权限隔离、内容风控与审计追踪后，发布到企业微信 / OA / 官网客服入口，按部门分批放量。"
      },
      {
        "title": "监控与迭代",
        "desc": "看板监控调用量、拒答率、采纳率与满意度；定期回流未覆盖问题，补充知识与同义词，灰度对比后再全量。"
      }
    ]
  }
}
