{
  "$schema": "../schema/template.schema.json",
  "id": "config-audit",
  "name": "网络配置智能稽核",
  "shortName": "配置稽核",
  "category": "ops",
  "industries": [
    "telecom",
    "energy"
  ],
  "tagline": "变更前发现风险，减少故障隐患",
  "icon": "scan",
  "kpis": [
    {
      "label": "配置错误检出率",
      "value": "+88%",
      "trend": "up"
    },
    {
      "label": "稽核覆盖率",
      "value": "100%",
      "trend": "up"
    },
    {
      "label": "关联故障下降",
      "value": "-46%",
      "trend": "down"
    }
  ],
  "painPoints": [
    "网络配置量大，人工稽核难以全覆盖",
    "配置错误是故障主要来源之一，事后才发现",
    "规则散落在专家脑中，难以沉淀"
  ],
  "capabilities": [
    {
      "key": "Parse",
      "name": "配置解析",
      "desc": "多厂商配置统一抽象建模"
    },
    {
      "key": "规则",
      "name": "规则引擎",
      "desc": "黑白名单 + 大模型语义稽核"
    },
    {
      "key": "差异",
      "name": "变更比对",
      "desc": "变更前后差异 + 风险评级"
    }
  ],
  "orchestration": {
    "nodes": [
      {
        "id": "n1",
        "type": "input",
        "label": "配置/脚本接入",
        "desc": "上传设备配置或风险操作脚本，支持批量"
      },
      {
        "id": "n2",
        "type": "tool",
        "label": "解析建模",
        "desc": "多厂商配置统一抽象建模，提取关键参数"
      },
      {
        "id": "n3",
        "type": "rag",
        "label": "规则稽核",
        "desc": "黑白名单 + 大模型语义稽核命令风险"
      },
      {
        "id": "n4",
        "type": "llm",
        "label": "差异比对",
        "desc": "变更前后差异识别与风险评级"
      },
      {
        "id": "n5",
        "type": "output",
        "label": "稽核报告",
        "desc": "自动生成 AI 稽核报告，问题项可下钻"
      }
    ]
  },
  "metrics": [
    {
      "name": "稽核覆盖",
      "value": "100",
      "unit": "%"
    },
    {
      "name": "配置规范率",
      "value": "90",
      "unit": "%"
    },
    {
      "name": "稽核精确率",
      "value": "95",
      "unit": "%"
    },
    {
      "name": "耗时节省",
      "value": "70",
      "unit": "%"
    }
  ],
  "demo": {
    "presets": [
      {
        "title": "批量配置稽核出报告",
        "user": "这批新入网交换机的配置帮我批量稽核一下，生成报告。",
        "steps": [
          {
            "type": "intent",
            "text": "意图识别：批量配置稽核（设备入网前检查）"
          },
          {
            "type": "tool",
            "text": "调用配置解析工具 + 网管采集接口 → 解析 36 台设备配置，统一建模后逐项比对稽核模板"
          },
          {
            "type": "doc",
            "text": "已生成批量稽核报告，问题项可下钻定位",
            "doc": {
              "title": "新入网设备配置稽核报告",
              "meta": "批量 36 台 · 稽核精确率 95%",
              "body": [
                "稽核结果：合格 31 台，存在风险 5 台。",
                "高危 1 项：SW-12 未配置 SNMP 访问控制，存在被探测风险。",
                "中危 3 项：3 台 NTP 时钟源缺失，影响日志时间一致性。",
                "低危 1 项：1 台描述字段缺失，不影响业务。",
                "结论：5 台需整改后方可入网，禁止「带病入网」。"
              ]
            }
          },
          {
            "type": "answer",
            "text": "36 台已批量稽核完成，5 台不合格已拦截。建议优先整改 SW-12 的 SNMP 访问控制（高危），整改后可一键复检。"
          }
        ]
      },
      {
        "title": "风险操作脚本 AI 审核",
        "user": "这是要执行的一段华为 MML 脚本，帮我审一下有没有风险。",
        "steps": [
          {
            "type": "intent",
            "text": "意图识别：风险脚本稽核（华为 MML 操作脚本）"
          },
          {
            "type": "rag",
            "text": "对照大网参数规范与风险命令清单，做语义级稽核"
          },
          {
            "type": "verdict",
            "text": "脚本风险稽核结论",
            "verdict": {
              "result": "发现高危命令 · 建议拦截",
              "tone": "fail",
              "summary": "脚本中包含可能造成批量退服的高危命令，建议人工复核后再执行。",
              "points": [
                "第 14 行 RMV BTS 缺少基站号约束，存在批量删除风险",
                "第 22 行参数 PWR 超出规范上限（实测 46 > 规范 43）",
                "缺少操作前的数据备份命令，无法快速回退",
                "建议：补全约束与备份、修正功率参数后重新提交稽核"
              ]
            }
          },
          {
            "type": "answer",
            "text": "已识别 1 处高危 + 1 处参数越限并拦截。修正后上传可实时获取新的稽核结果，避免风险操作上网。"
          }
        ]
      },
      {
        "title": "变更前后差异比对",
        "user": "这台设备割接前后的配置帮我比对下，有没有改错的地方？",
        "steps": [
          {
            "type": "intent",
            "text": "意图识别：变更前后差异比对（割接核对）"
          },
          {
            "type": "tool",
            "text": "调用配置快照存储接口 + diff 比对工具 → 拉取割接前后配置快照，逐行 diff 并做风险评级"
          },
          {
            "type": "table",
            "text": "配置差异比对结果",
            "columns": [
              "配置项",
              "变更前",
              "变更后",
              "评级"
            ],
            "rows": [
              [
                "上联带宽",
                "10GE",
                "100GE",
                "正常 ✓"
              ],
              [
                "VLAN 透传",
                "100-200",
                "100-300",
                "正常 ✓"
              ],
              [
                "默认路由",
                "存在",
                "缺失",
                "高危 ⚠"
              ],
              [
                "ACL 策略",
                "策略A",
                "策略A",
                "未变更"
              ]
            ]
          },
          {
            "type": "answer",
            "text": "## 比对结论\n本次割接共比对 4 项配置，发现 **1 处高危差异**：\n- ⚠ **默认路由缺失**（割接后）：可能导致**跨网段不通**，风险最高。\n- 上联带宽 10GE → 100GE：正常 ✓。\n- VLAN 透传扩展、ACL 策略：正常 / 未变更。\n## 处置建议\n- **立即补回默认路由**，再观察跨网段连通性。\n> 是否生成整改记录并标记本次割接为「需复核」？"
          }
        ]
      }
    ]
  },
  "build": {
    "intro": "稽核场景要先有「标准模板 + 风险清单」，再接设备做批量比对与报告。",
    "steps": [
      {
        "title": "生成配置稽核模板",
        "desc": "用大模型基于现网规范生成各网元/交换机的配置稽核模板，沉淀黑白名单与风险命令清单。"
      },
      {
        "title": "对接设备与配置获取",
        "desc": "通过 OSS/网管接口获取设备配置与脚本，做多厂商统一抽象建模，支持批量拉取。"
      },
      {
        "title": "编排稽核与比对流程",
        "desc": "用流程引擎串联解析 → 规则稽核 → 语义稽核 → 差异比对 → 风险评级，嵌入入网与变更前后检查点。"
      },
      {
        "title": "配置报告模板",
        "desc": "定义稽核报告结构（高/中/低危分级、问题下钻），用历史脚本回测稽核精确率达标后灰度。"
      }
    ]
  },
  "deploy": {
    "intro": "已全省能力发布，按「工具试用 → 嵌入流程 → 全网覆盖 → 规则迭代」推进上线。",
    "steps": [
      {
        "title": "工具化试用",
        "desc": "先以独立稽核工具/机器人形式开放，运维上传配置或脚本即得稽核结果，验证精确率。"
      },
      {
        "title": "嵌入入网与变更流程",
        "desc": "把稽核能力前置到设备入网与操作变更前后检查点，确保「不带病入网/割接」。"
      },
      {
        "title": "全网设备覆盖",
        "desc": "从无线 MML 脚本扩展到核心网、承载网设备配置稽核，逐步实现全网全覆盖。"
      },
      {
        "title": "规则持续迭代",
        "desc": "现网规范与风险命令更新即同步模板，监控故障配置发现率与精确率，持续优化提示词与规则。"
      }
    ]
  }
}
