{
  "$schema": "../schema/template.schema.json",
  "id": "service-analysis",
  "name": "客服工单智能分析",
  "shortName": "智慧分析",
  "category": "governance",
  "industries": [
    "telecom",
    "finance",
    "government",
    "education",
    "retail",
    "healthcare"
  ],
  "tagline": "自动摘要、自动归类、自动发现服务风险",
  "icon": "headset",
  "kpis": [
    {
      "label": "工单分类准确率",
      "value": "96%",
      "trend": "up"
    },
    {
      "label": "服务风险预警提前量",
      "value": "+72h",
      "trend": "up"
    },
    {
      "label": "质检覆盖率",
      "value": "100%",
      "trend": "up"
    }
  ],
  "painPoints": [
    "海量工单靠人工抽检，覆盖率低",
    "服务风险隐藏在长尾投诉中，难以发现",
    "工单归类粒度粗，难以指导改进"
  ],
  "capabilities": [
    {
      "key": "Summary",
      "name": "智能摘要",
      "desc": "长对话 → 关键诉求 + 处置过程 + 结果三段式摘要"
    },
    {
      "key": "Classify",
      "name": "多级分类",
      "desc": "三级标签自动打标，支持人工反馈学习"
    },
    {
      "key": "Risk",
      "name": "风险挖掘",
      "desc": "异常波动 + 情绪识别，提前发现批量服务问题"
    }
  ],
  "orchestration": {
    "nodes": [
      {
        "id": "n1",
        "type": "input",
        "label": "工单接入",
        "desc": "批量导入受理录音转写文本与投诉工单"
      },
      {
        "id": "n2",
        "type": "llm",
        "label": "智能摘要",
        "desc": "提取诉求 / 处置过程 / 结果三段式摘要，100% 覆盖"
      },
      {
        "id": "n3",
        "type": "intent",
        "label": "多级归类",
        "desc": "198 个投诉场景自动打标，支持人工反馈学习"
      },
      {
        "id": "n4",
        "type": "tool",
        "label": "业务核查",
        "desc": "调用业务办理记录，比对工单事实"
      },
      {
        "id": "n5",
        "type": "output",
        "label": "判责与风险",
        "desc": "综合判断企业是否担责，挖掘批量服务风险并预警"
      }
    ]
  },
  "metrics": [
    {
      "name": "月均分析",
      "value": "34w",
      "unit": "张"
    },
    {
      "name": "覆盖场景",
      "value": "198",
      "unit": "类"
    },
    {
      "name": "摘要覆盖",
      "value": "100",
      "unit": "%"
    },
    {
      "name": "风险预警",
      "value": "+72h",
      "unit": ""
    }
  ],
  "demo": {
    "presets": [
      {
        "title": "批量工单摘要 + 归类",
        "user": "把今天新进的这批投诉工单做摘要和归类，给我一张清单。",
        "steps": [
          {
            "type": "intent",
            "text": "意图识别：批量处理（摘要 + 多级归类）"
          },
          {
            "type": "tool",
            "text": "调用工单系统接口 + 录音转写工具 → 读取今日新增工单 3,182 张，逐单转写、摘要、打标"
          },
          {
            "type": "table",
            "text": "批量处理结果（节选）",
            "columns": [
              "工单号",
              "诉求摘要",
              "归类",
              "情绪"
            ],
            "rows": [
              [
                "TS-0461",
                "宽带频繁掉线 3 天未解决",
                "故障类·宽带稳定性",
                "愤怒"
              ],
              [
                "TS-0462",
                "流量包扣费与宣传不符",
                "资费类·计费争议",
                "不满"
              ],
              [
                "TS-0463",
                "携号转网办理受阻",
                "业务类·携转",
                "中性"
              ],
              [
                "TS-0464",
                "客服承诺回访未兑现",
                "服务类·承诺未履行",
                "失望"
              ]
            ]
          },
          {
            "type": "answer",
            "text": "## 处理结果\n已完成今日新增 **3,182 张**工单的摘要与三级归类，覆盖率 **100%**。\n- 故障类、资费类、业务类、服务类四大类已全部打标。\n- ⚠ 「**计费争议**」较昨日 **+37%**，已标记为需关注。\n## 后续\n- 完整清单可导出 **Excel**，支持按归类 / 情绪二次筛选。\n> 是否针对「计费争议」做专项下钻，定位是否为同一业务引起？"
          }
        ]
      },
      {
        "title": "服务风险趋势（出图预警）",
        "user": "最近有没有批量性的服务风险冒头？",
        "steps": [
          {
            "type": "intent",
            "text": "意图识别：服务风险挖掘（异常波动）"
          },
          {
            "type": "tool",
            "text": "调用工单系统接口 + 聚类分析工具 → 对近 7 天工单做场景聚类 + 环比异常检测"
          },
          {
            "type": "chart",
            "chartType": "hbar",
            "text": "近 7 天投诉场景环比增幅 TOP",
            "bars": [
              {
                "label": "某流量包计费争议",
                "pct": 100,
                "value": "+212%"
              },
              {
                "label": "宽带掉线(城西)",
                "pct": 64,
                "value": "+136%"
              },
              {
                "label": "携转办理受阻",
                "pct": 33,
                "value": "+70%"
              }
            ]
          },
          {
            "type": "answer",
            "text": "## 风险预警\n监测到一处**批量性服务风险**，已提前 **72 小时**预警：\n- ⚠ 「**某流量包计费争议**」7 天内激增 **+212%**，为最高增幅。\n- 投诉集中在**上周新上线的促销包**，疑似计费配置异常。\n## 处置建议\n- **立即核查**该促销包的计费规则与生效配置。\n- 排查存量受影响用户，准备统一话术与补偿预案。\n> 是否立即生成风险工单并通知计费配置负责人？"
          }
        ]
      },
      {
        "title": "投诉判责（反驳举证）",
        "user": "这条投诉用户说我们乱扣费要求双倍赔偿，到底该不该我们担责？",
        "steps": [
          {
            "type": "intent",
            "text": "意图识别：投诉判责（计费争议）"
          },
          {
            "type": "llm",
            "text": "解析投诉全文，提炼核心诉求：主张未经同意开通增值业务并扣费"
          },
          {
            "type": "tool",
            "text": "调用业务办理记录：核查订购渠道、时间与授权凭证"
          },
          {
            "type": "verdict",
            "text": "综合工单事实与业务记录的判责结论",
            "verdict": {
              "result": "企业不担责",
              "tone": "pass",
              "summary": "用户主张「未经同意开通」与业务记录不符，建议据实说明、不予赔偿。",
              "points": [
                "该增值业务于 5 月 8 日经用户本人 App 主动订购，有点击授权日志留痕",
                "订购后已下发确认短信，用户当月正常使用 18 天无异议",
                "扣费金额与公示资费一致，不存在重复或超额扣费",
                "建议话术：向用户出示订购授权记录与使用明细，说明扣费合规"
              ]
            }
          },
          {
            "type": "answer",
            "text": "判定：企业不担责，但用户情绪激动、有升级风险。建议客服主动出示授权与使用凭证、耐心解释，并赠送小额流量券安抚，避免投诉升级。"
          }
        ]
      }
    ]
  },
  "build": {
    "intro": "分析类场景以「批量跑批 + 标签体系」为核心，先定义场景标签，再接业务系统做判责。",
    "steps": [
      {
        "title": "接入工单与录音数据",
        "desc": "对接受理系统，把通话录音转写为文本，批量导入历史投诉工单作为冷启动样本。"
      },
      {
        "title": "定义场景标签与摘要模板",
        "desc": "梳理 198 个投诉场景的三级标签体系，配置「诉求/处置/结果」三段式摘要提示词。"
      },
      {
        "title": "对接业务系统做判责",
        "desc": "登记业务办理、计费、授权日志等接口，让判责能基于真实事实而非仅凭文本，沉淀判责规则。"
      },
      {
        "title": "配置批量跑批与风险规则",
        "desc": "设置定时批量任务（每日全量摘要归类），配置环比异常检测与情绪识别阈值用于风险预警。"
      }
    ]
  },
  "deploy": {
    "intro": "后台分析型应用，以「跑批试运行 → 标签校准 → 全量生产 → 风险运营」方式上线。",
    "steps": [
      {
        "title": "跑批试运行",
        "desc": "先对历史工单跑批，人工抽检摘要与归类准确率，校准标签与提示词。"
      },
      {
        "title": "标签与判责校准",
        "desc": "运营人员对误判样本反馈纠正，模型学习后回归；判责规则与法务/客服对齐确认。"
      },
      {
        "title": "全量生产上线",
        "desc": "切换为每日全量自动跑批，月均处理 34w 张工单，输出摘要、归类与判责建议。"
      },
      {
        "title": "风险运营迭代",
        "desc": "风险看板实时预警批量服务问题，新增场景标签按月扩充，持续提升覆盖与准确率。"
      }
    ]
  }
}
