{
  "$schema": "../schema/template.schema.json",
  "id": "engineer-monitor",
  "name": "工程建设智能监管",
  "shortName": "工程监管",
  "category": "engineer",
  "industries": [
    "manufacturing",
    "energy",
    "retail"
  ],
  "tagline": "问知识、问数据、看现场、识风险",
  "icon": "build",
  "kpis": [
    {
      "label": "异常发现及时率",
      "value": "+85%",
      "trend": "up"
    },
    {
      "label": "现场巡检效率",
      "value": "+60%",
      "trend": "up"
    },
    {
      "label": "合规风险识别",
      "value": "+73%",
      "trend": "up"
    }
  ],
  "painPoints": [
    "工程现场分散，人工巡检覆盖不足",
    "施工合规要求多，违规难以及时发现",
    "进度数据滞后，决策难以前置"
  ],
  "capabilities": [
    {
      "key": "知识",
      "name": "规范问答",
      "desc": "施工规范 / 安全标准知识问答"
    },
    {
      "key": "T2SQL",
      "name": "进度问数",
      "desc": "项目进度 / 资源数据自然语言查询"
    },
    {
      "key": "Multimodal",
      "name": "现场识别",
      "desc": "摄像头视频流违规行为/隐患识别"
    }
  ],
  "orchestration": {
    "nodes": [
      {
        "id": "n1",
        "type": "input",
        "label": "多形态输入",
        "desc": "问知识 / 问数据 / 上传现场图片或视频流"
      },
      {
        "id": "n2",
        "type": "intent",
        "label": "意图分流",
        "desc": "区分规范问答、进度问数、现场隐患识别"
      },
      {
        "id": "n3",
        "type": "rag",
        "label": "规范检索",
        "desc": "施工规范、安全标准 7k+ 知识库召回"
      },
      {
        "id": "n4",
        "type": "multimodal",
        "label": "视觉识别",
        "desc": "小模型+大模型识别未戴安全帽、违规作业等隐患"
      },
      {
        "id": "n5",
        "type": "action",
        "label": "生成工单",
        "desc": "命中隐患自动生成整改工单并短信预警闭环"
      }
    ]
  },
  "metrics": [
    {
      "name": "知识库条目",
      "value": "7000+",
      "unit": "条"
    },
    {
      "name": "覆盖场景",
      "value": "5",
      "unit": "类"
    },
    {
      "name": "生产调用",
      "value": "25w+",
      "unit": "次"
    },
    {
      "name": "隐患识别",
      "value": "实时",
      "unit": ""
    }
  ],
  "demo": {
    "presets": [
      {
        "title": "施工规范知识问答",
        "user": "高空作业安全带必须怎么挂？规范是怎么要求的？",
        "steps": [
          {
            "type": "intent",
            "text": "意图识别：规范知识问答（高空作业安全）"
          },
          {
            "type": "rag",
            "text": "召回《通信建设工程安全生产操作规范》第 4.3 条等 3 处依据"
          },
          {
            "type": "answer",
            "text": "依据《安全生产操作规范》4.3 条，高空作业应遵循「高挂低用」：\n  1. 安全带须挂在作业位置上方牢固结构件上，禁止挂在移动或不牢固物体上；\n  2. 2 米及以上高处作业必须系挂安全带并佩戴安全帽；\n  3. 作业前检查安全带部件完好，禁止超期使用。\n（来源：规范第 4.3 条，可点击查看原文）"
          }
        ]
      },
      {
        "title": "工程进度问数（出图）",
        "user": "帮我看看本季度在建项目的进度达成情况。",
        "steps": [
          {
            "type": "intent",
            "text": "意图识别：进度问数（在建项目，本季度）"
          },
          {
            "type": "tool",
            "text": "调用 Text2SQL 工具查询项目管理库 → 按区域统计计划工期达成率"
          },
          {
            "type": "chart",
            "chartType": "bar",
            "text": "本季度在建项目进度达成率",
            "bars": [
              {
                "label": "城区局",
                "pct": 96,
                "value": "96%"
              },
              {
                "label": "高新局",
                "pct": 88,
                "value": "88%"
              },
              {
                "label": "郊县局",
                "pct": 71,
                "value": "71% ⚠"
              }
            ]
          },
          {
            "type": "answer",
            "text": "## 进度概览\n本季度在建项目整体达成率 **85%**，总体可控，但区域分化明显。\n- **城区局**：96%，进度领先。\n- **高新局**：88%，基本达标。\n- ⚠ **郊县局**：71%，明显滞后。\n## 滞后归因\n- 郊县局滞后主因是 **2 个 OTN 项目因管道协调延期**，并非施工力量不足。\n## 行动建议\n- 重点**督办郊县局**两个 OTN 项目，优先协调管道资源。\n> 已定位到具体项目清单，是否一键生成督办工单？"
          }
        ]
      },
      {
        "title": "现场拍照隐患识别（多模态）",
        "user": "[现场照片] 帮我看看这个施工现场有没有违规。",
        "steps": [
          {
            "type": "intent",
            "text": "意图识别：现场隐患识别（图片）"
          },
          {
            "type": "multimodal",
            "text": "视觉模型识别：作业人员未佩戴安全帽（置信度 96.2%）、临边无防护栏"
          },
          {
            "type": "image",
            "text": "已框选 2 处隐患：① 未戴安全帽 ② 临边缺防护",
            "shot": "现场隐患识别结果"
          },
          {
            "type": "action",
            "text": "✅ 自动生成整改工单 #AQ-20260611-038  ✅ 短信预警推送至现场负责人  ✅ 限时整改并要求回传整改照片闭环"
          }
        ]
      }
    ]
  },
  "build": {
    "intro": "工程监管融合「知识 + 数据 + 视觉」三类能力，建库、接数、训视觉模型缺一不可。",
    "steps": [
      {
        "title": "建设规范知识库",
        "desc": "导入规章制度、建设监理、规划设计等 7k+ 文档并向量化，按五大场景分库，保留条文出处用于引用回链。"
      },
      {
        "title": "对接工程数据与视频流",
        "desc": "打通项目管理库（投资、工期、进度）做 Text2SQL；接入施工现场摄像头视频流与抓拍图片通道。"
      },
      {
        "title": "训练隐患识别模型",
        "desc": "用历史隐患图片微调多模态模型（未戴安全帽、临边防护、动火作业等），小模型负责检测、大模型负责研判与描述。"
      },
      {
        "title": "编排监管 Agent 与闭环",
        "desc": "意图分流到问答/问数/识别；命中隐患自动生成整改工单 + 短信预警，要求回传整改照片形成闭环。"
      }
    ]
  },
  "deploy": {
    "intro": "已在生产实际应用、调用量 25w+，遵循「单场景试点 → 扩场景 → 全省 → 闭环运营」节奏。",
    "steps": [
      {
        "title": "单场景试点",
        "desc": "先上「规范问答」低风险场景验证召回与准确率，再上进度问数。"
      },
      {
        "title": "视觉识别灰度",
        "desc": "隐患识别先在数个工地灰度，人工复核识别结果，校准误报率后再扩点。"
      },
      {
        "title": "生产上线与系统对接",
        "desc": "AI 能力注册到平台，嵌入工程管理系统与安全云监管，打通工单与短信预警。"
      },
      {
        "title": "闭环运营迭代",
        "desc": "监控识别准确率与整改闭环率，新增隐患类型回流训练，规范库按文件更新同步。"
      }
    ]
  }
}
