{
  "$schema": "../schema/template.schema.json",
  "id": "retail-guide",
  "name": "门店导购 Copilot",
  "shortName": "智能导购",
  "category": "service",
  "industries": [
    "retail"
  ],
  "tagline": "商品推荐 + 产品手册问答 + 售后客服一体化",
  "icon": "support",
  "highlight": true,
  "kpis": [
    {
      "label": "导购连带销售率",
      "value": "+24%",
      "trend": "up"
    },
    {
      "label": "售后自助解决率",
      "value": "+80%",
      "trend": "up"
    },
    {
      "label": "新人上手周期",
      "value": "-70%",
      "trend": "down"
    }
  ],
  "painPoints": [
    "SKU 成百上千、型号参数复杂，新导购记不住、推不准",
    "客户咨询的产品手册问题，导购需翻文档，应答慢、转人工率高",
    "高转化导购的话术与连带技巧难以沉淀、复制到全门店",
    "售后退换、保修政策口径不一，容易引发纠纷"
  ],
  "capabilities": [
    {
      "key": "推荐",
      "name": "商品智能推荐",
      "desc": "按客户需求与场景匹配 SKU 并给连带方案"
    },
    {
      "key": "知识",
      "name": "产品手册问答",
      "desc": "7500+ 产品文档秒级问答，图文并茂"
    },
    {
      "key": "话术",
      "name": "金牌话术辅助",
      "desc": "学习高转化导购话术与连带技巧"
    },
    {
      "key": "售后",
      "name": "售后政策问答",
      "desc": "退换货、保修政策统一口径可信问答"
    }
  ],
  "metrics": [
    {
      "name": "接入文档",
      "value": "7500+",
      "unit": "份"
    },
    {
      "name": "覆盖门店",
      "value": "500+",
      "unit": "家"
    },
    {
      "name": "出图率",
      "value": "70",
      "unit": "%"
    },
    {
      "name": "转人工下降",
      "value": "-8",
      "unit": "个点"
    }
  ],
  "demo": {
    "presets": [
      {
        "title": "需求导购 + 连带推荐",
        "user": "客户家里 30 平客厅，有小孩想买台静音的空气净化器，预算 3000 内，推哪款？",
        "steps": [
          {
            "type": "intent",
            "text": "意图识别：商品推荐（空气净化器·场景+预算匹配）"
          },
          {
            "type": "tool",
            "text": "调用商品库接口 → 按「适用 30㎡ + 低噪音 + ≤3000 元」筛选在售机型 6 款"
          },
          {
            "type": "rag",
            "text": "知识库召回各机型 CADR、噪音、滤网参数与母婴场景卖点"
          },
          {
            "type": "answer",
            "text": "## 推荐机型（匹配 30㎡ + 静音 + 预算内）\n- **首推 · X3 Pro（2699 元）**：CADR 400，睡眠模式 **33 分贝**（接近图书馆），带甲醛数显，母婴家庭首选。\n- **备选 · A2（1999 元）**：CADR 300，性价比高，适合预算更紧的客户。\n## 推荐话术\n「您家 30 平加上有小孩，最看重的是静音和除醛。这台 X3 Pro 睡眠模式只有 33 分贝，孩子睡觉完全不吵，还能实时显示甲醛数值，比较安心。」\n## 连带建议\n- 可连带推荐**原装滤网套装（+299）**，提示「滤网半年一换，一次配齐更划算」。\n> 是否生成这款机型的图文介绍发给客户？"
          }
        ]
      },
      {
        "title": "产品手册图文问答",
        "user": "客户问这台 X3 Pro 的滤网多久换一次、怎么自己换，我怎么答？",
        "steps": [
          {
            "type": "intent",
            "text": "意图识别：产品手册问答（滤网更换·X3 Pro）"
          },
          {
            "type": "rag",
            "text": "调用产品文档知识库 → 召回《X3 Pro 用户手册》滤网维护章节（含图示）"
          },
          {
            "type": "image",
            "text": "滤网更换步骤图：打开后盖 → 取出旧滤网 → 撕膜装入新滤网 → 复位",
            "shot": "X3 Pro 滤网更换示意"
          },
          {
            "type": "answer",
            "text": "## 滤网更换（可直接讲给客户）\n**更换周期**：日常使用约 **6-12 个月**更换一次；机器检测到滤网寿命到期会**亮灯提醒**。\n**更换步骤**（很简单，客户自己就能换）：\n  1. 关机断电，打开机器**后盖**；\n  2. 按箭头方向**取出旧滤网**；\n  3. 撕掉新滤网外包装膜，**对准卡槽装入**；\n  4. 盖回后盖，开机**长按重置键 3 秒**清除滤网提醒。\n（来源：X3 Pro 用户手册 P12，附图示）\n> 需要我把这张图文步骤直接发给客户微信吗？"
          }
        ]
      },
      {
        "title": "售后退换政策问答",
        "user": "客户买了 5 天说不想要了要退货，但包装拆了，能退吗？",
        "steps": [
          {
            "type": "intent",
            "text": "意图识别：售后政策问答（七天无理由·已拆封）"
          },
          {
            "type": "rag",
            "text": "调用售后政策知识库 → 召回《七天无理由退换货实施细则》相关条款"
          },
          {
            "type": "tool",
            "text": "调用订单系统接口 → 核验该订单：实付 2699 元、签收第 5 天、无人为损坏记录"
          },
          {
            "type": "answer",
            "text": "## 政策结论\n**可以退货**。该订单在签收 **7 天内**（第 5 天），符合七天无理由退货条件。\n## 关于「已拆封」\n- 拆封**不影响**七天无理由退货，只要**商品完好、配件齐全、不影响二次销售**即可。\n- 滤网等一次性耗材如已使用，可能酌情扣减，请如实告知客户。\n## 办理建议\n  1. 确认主机、滤网、电源线、说明书等**配件齐全**；\n  2. 在订单系统发起退货，物流费按签收无理由规则承担；\n  3. 退款原路返回，预计 1-3 个工作日到账。\n> 是否直接为该订单发起退货流程？"
          }
        ]
      }
    ]
  }
}
