{
  "$schema": "../schema/template.schema.json",
  "id": "smart-support",
  "name": "一线支撑助手",
  "shortName": "智慧优问",
  "category": "service",
  "industries": [
    "telecom",
    "government"
  ],
  "tagline": "问答、派单、预警一体化",
  "icon": "support",
  "kpis": [
    {
      "label": "一线人员问答自助率",
      "value": "+58%",
      "trend": "up"
    },
    {
      "label": "派单准确率",
      "value": "94%",
      "trend": "up"
    },
    {
      "label": "预警响应时长",
      "value": "-50%",
      "trend": "down"
    }
  ],
  "painPoints": [
    "一线问题杂、专家有限，咨询长期排队",
    "派单靠规则，复杂场景命中率低",
    "预警渠道分散，一线感知滞后"
  ],
  "capabilities": [
    {
      "key": "知识",
      "name": "知识问答",
      "desc": "常见问答 / 政策 / 操作手册全量召回"
    },
    {
      "key": "Dispatch",
      "name": "智能派单",
      "desc": "技能 + 负载 + 历史绩效综合调度"
    },
    {
      "key": "Alert",
      "name": "预警推送",
      "desc": "关键事件主动推送到对应人员"
    }
  ],
  "orchestration": {
    "nodes": [
      {
        "id": "n1",
        "type": "input",
        "label": "一线提问",
        "desc": "营业员/装维用自然语言描述问题或诉求"
      },
      {
        "id": "n2",
        "type": "intent",
        "label": "意图识别",
        "desc": "区分知识问答 / 故障派单 / 预警查询"
      },
      {
        "id": "n3",
        "type": "rag",
        "label": "知识问答",
        "desc": "政策、操作手册、常见问答全量召回并引用"
      },
      {
        "id": "n4",
        "type": "tool",
        "label": "智能派单",
        "desc": "按问题类型 + 派单规则精准匹配处理团队"
      },
      {
        "id": "n5",
        "type": "action",
        "label": "预警推送",
        "desc": "卡单、系统异常等关键事件主动推送看板"
      }
    ]
  },
  "metrics": [
    {
      "name": "覆盖用户",
      "value": "1w+",
      "unit": "人"
    },
    {
      "name": "月均问答",
      "value": "1.5w",
      "unit": "次"
    },
    {
      "name": "月均派单",
      "value": "3w",
      "unit": "张"
    },
    {
      "name": "工单下降",
      "value": "-2000",
      "unit": "单/月"
    }
  ],
  "demo": {
    "presets": [
      {
        "title": "政策操作智能问答",
        "user": "老用户办理携号转网，营业厅这边需要哪些前置条件？",
        "steps": [
          {
            "type": "intent",
            "text": "意图识别：业务知识问答（携号转网办理条件）"
          },
          {
            "type": "rag",
            "text": "召回《携号转网办理规程》与最新政策通知 2 处依据"
          },
          {
            "type": "answer",
            "text": "携号转网需同时满足：\n  1. 已实名登记，且号码非挂失/停机状态；\n  2. 无在网协议期限制（如有合约需先到期或解约）；\n  3. 结清当月及历史欠费；\n  4. 该号码 120 天内无携转记录。\n可先用「一键校验」帮客户查是否满足，再走办理流程。（来源：携转办理规程 2.1 节）"
          }
        ]
      },
      {
        "title": "复杂问题智能派单",
        "user": "客户反映集团专线时通时断，营业厅处理不了，怎么派单？",
        "steps": [
          {
            "type": "intent",
            "text": "意图识别：故障派单（集团专线·时通时断）"
          },
          {
            "type": "tool",
            "text": "调用智能派单引擎 → 匹配派单规则：专线类故障 → 政企网络支撑组（技能+负载+绩效综合调度）"
          },
          {
            "type": "answer",
            "text": "已为您精准派单：\n  • 受理类型：集团专线故障（间歇性中断）\n  • 派往团队：政企网络支撑组-张工（当前负载低、专线处理绩效 A）\n  • 已附带：客户专线编号、故障现象、营业厅初判信息\n派单准确率 94%，预计 30 分钟内响应。"
          }
        ]
      },
      {
        "title": "关键事件预警看板",
        "user": "现在有哪些需要一线重点关注的预警？",
        "steps": [
          {
            "type": "intent",
            "text": "意图识别：预警查询（关键事件看板）"
          },
          {
            "type": "tool",
            "text": "调用预警监测服务接口 → 实时监测集团业务 / 增值业务 / 结算 / 新业务四类预警"
          },
          {
            "type": "chart",
            "chartType": "hbar",
            "text": "当前活跃预警（按影响工单数）",
            "bars": [
              {
                "label": "新业务·系统卡单",
                "pct": 100,
                "value": "86 单"
              },
              {
                "label": "增值业务·开通失败",
                "pct": 55,
                "value": "47 单"
              },
              {
                "label": "结算·对账异常",
                "pct": 24,
                "value": "21 单"
              }
            ]
          },
          {
            "type": "answer",
            "text": "## 当前预警概览\n共监测到 **3 类活跃预警**，整体可控但需重点盯防一处：\n- ⚠ **新业务·系统卡单**：影响 **86 单**且仍在上升，优先级最高。\n- **增值业务·开通失败**：47 单。\n- **结算·对账异常**：21 单。\n## 处置建议\n- 已主动推送至**新业务支撑负责人**跟进。\n- 建议一线**先暂缓该业务办理**，避免卡单进一步扩大。\n> 是否生成一线提醒公告并下发到各营业厅？"
          }
        ]
      }
    ]
  },
  "build": {
    "intro": "一线支撑要「问得准、派得对、报得早」，先建知识库，再配派单规则与预警监测。",
    "steps": [
      {
        "title": "沉淀一线知识库",
        "desc": "汇集政策文件、操作手册、常见问答对并向量化，按业务条线分库，保留出处方便一线核对。"
      },
      {
        "title": "配置派单规则引擎",
        "desc": "梳理问题类型与处理团队映射，配置「技能 + 负载 + 历史绩效」综合调度策略，定义升级路径。"
      },
      {
        "title": "接入预警监测",
        "desc": "对接业务系统关键事件（卡单、系统异常、开通失败等），配置阈值与四类预警看板及推送对象。"
      },
      {
        "title": "编排支撑 Agent",
        "desc": "用标准模式按意图分流到问答 / 派单 / 预警；问答强制引用来源，派单与预警动作可追溯。"
      }
    ]
  },
  "deploy": {
    "intro": "面向上万一线人员，按「试点地市 → 准确率达标 → 全省接入 → 知识运营」推进。",
    "steps": [
      {
        "title": "试点地市",
        "desc": "选 1-2 个地市先行，验证问答自助率与派单准确率，收集一线高频问法。"
      },
      {
        "title": "准确率评测",
        "desc": "建立问答与派单评测集，回归命中率；错误样本回流补充语料与规则。"
      },
      {
        "title": "全省接入入口",
        "desc": "嵌入营业、装维使用的工作台与企业微信，开放给全省一线人员。"
      },
      {
        "title": "知识与规则运营",
        "desc": "监控自助率、派单准确率与预警响应时长，知识库与派单规则按周迭代。"
      }
    ]
  }
}
